Year	Headline	Link	Intro	Page
2020-03-10	他们的誓言	https://nei.st/medium/yimag/poqrsxw7acdt1hskdblhbg	高强度的工作，匮乏的物资，浓重的病毒，响亮的集结号，生死之交——疫情时期，这些是一线医护人员的日常	34
2020-03-10	我给医院捐了 300 瓶消毒液，想换一个妈妈的住院资格	https://nei.st/medium/yimag/poqrsxw7acdt4hskdblhbg	医院收下了她的消毒液，但她没有开口	34
2020-03-10	关于新冠病毒，我们目前所知道的	https://nei.st/medium/wsj/what-we-know-about-the-coronavirus-from-symptoms-to-who-is-at-risk	科学家和公共卫生官员一直在试图了解有关新型冠状病毒的情况	34
2020-03-10	新冠病毒基因测序溯源：警报是何时拉响的	https://nei.st/medium/caixin/lhchvbypnk5anp9stg61	种种证据显示，在去年 12 月底之前，有不少于九名不明肺炎病例的样本被从武汉各医院采集，基因测序显示病原体是一种类 SARS 冠状病毒，这些检测结果陆续回馈医院并上报给了卫健委和疾控系统	34
2020-03-10	瘟疫、语言和具体的人：与历史学家罗新的聊天	https://nei.st/medium/surplusvalue-luoxin-podcast	剩余价值播客 051	34
2020-03-10	中国对疫情的审查和宣传产生负面效果	https://nei.st/medium/wsj/chinas-virus-censorship-and-propaganda-draw-backlash	人们质疑中国媒体缺乏批判性报道，并对他们所称的打造共产党英雄的拙劣做法不屑一顾	34
2020-03-10	中国判处书商桂敏海 10 年监禁	https://nei.st/medium/wsj/china-sentences-bookseller-gui-minhai-to-10-years-in-jail	为了让该政权能便利行事，他们就迫使某人重新成为中国公民	34
2020-03-10	成为科比：一个商业体育偶像的生与死	https://nei.st/medium/initium/kobe-nba-influence	全球化时代的商业体育受众期待在偶像身上感知到更多与「热血」和「拼搏」相连的纯粹特质，而经营者热衷的却是兜售更有噱头的产品。作为大众偶像的科比·布莱恩特，因此成为极其矛盾的存在	34
2020-03-10	新冠疫情对经济的冲击源自恐慌，而非疫情本身	https://nei.st/medium/wsj/fear-of-coronavirus-rather-than-virus-itself-hits-economies	流行病也会引发广泛的不确定性甚至恐慌，政府部门和个人通常会大幅削减风险敞口	34
2020-02-29	只因没染上新冠，他们一再错过最佳治疗期	https://nei.st/medium/caixin/rot9-7lr1p8rff_t9wbk2w	随着新冠疫情防控战事拉长，留给各种非新冠患者就诊和治疗的空间却不断收窄，许多病人的生死亦悬于一线	34
2020-02-29	半导体信号	https://nei.st/medium/economist/buttonwood/the-semaphore-of-semis	从亚洲芯片业看世界经济	35
2020-02-29	奉俊昊的奥斯卡与韩国电影的疯狂秘密	https://nei.st/medium/fengjunhao-and-korean-movie-industry	奉俊昊说「我们写剧本不是为了代表国家，但这是给韩国的第一座奥斯卡奖杯。」	35
2020-02-29	恶疾之扰	https://nei.st/medium/economist/a-deadly-disease-disrupts	新型冠状病毒可能会对全球供应链产生持久的冲击	35
2020-02-29	翻箱倒柜	https://nei.st/medium/economist/free-exchange/rummaging-in-the-toolbox	经济学家希望能靠收益率曲线控制抵御下一次衰退，但这可能还不够	35
2020-02-29	冠状病毒：走不行，得跑了	https://nei.st/medium/economist/run-dont-walk	科学家正紧急研发疫苗对抗新型冠状病毒，即便赶不上眼前的疫情，他们的努力也不会白费	35
2020-02-29	从模范开局到全境失守：韩国防疫的不确定未来	https://nei.st/medium/initium/korea-coronavirus-break-out	韩国在 2015 年的 MERS 疫情中吸取了惨痛教训，但还是没能避免如今肺炎疫情猝不及防的爆发	35
2020-02-29	疫症危机与安倍体制，战后最集权的首相如何陷入困境？	https://nei.st/medium/initium/japan-coronavirus-abe-shinzo	对安倍而言，东京奥运会终究是无法放弃的最大政绩，这也让揣度上意的官僚们在应对疫情时尤为迟缓	35
2020-02-29	冠状病毒经济学：封城	https://nei.st/medium/economist/locked-down	中国的半隔离状态将损害国内外经济增长	35
2020-02-29	恢复记忆	https://nei.st/medium/economist/memory-loss-and-gain	芯片制造商度过了艰难的一年，形势正在好转	35
2020-02-29	贝佐斯的大计划	https://nei.st/medium/atlantic/jeff-bezoss-master-plan	亚马逊的创始人 CEO 为他的帝国和他自己做了哪些安排？他的大计对我们又意味着什么？	35
2020-02-29	两月来，华南海鲜市场附近福利院发生连续密集死亡	https://nei.st/medium/caixin/bd7ob5jnmh0jiny8	武汉市社会福利院距离华南海鲜市场仅数百米，2019 年 12 月至 2020 年 2 月密集死亡 19 人	36
2020-02-29	会会新老板	https://nei.st/medium/economist/meet-the-new-boss	2020 年代的管理经	36
2020-02-29	商业秘密：种豆得豆	https://nei.st/medium/economist/as-you-sow	《科学家与间谍》书评：爱荷华州种子偷盗事件如何刺激了美国对中国的忧惧	36
2020-02-29	辛格与孙正义 PK	https://nei.st/medium/economist/singer-son-time	美国一家维权投资机构想要促成软银改革。祝好运	36
2020-02-29	高通共产主义宣言	https://nei.st/medium/economist/schumpeter/the-qualcommunist-manifesto	靠仿效国家资本主义，美国将无法在 5G 上击败中国	36
2020-02-29	最佳数字	https://nei.st/medium/economist/bartleby/the-number-of-the-best	探索团队和组织的最佳规模	36
2020-02-29	民间大救援	https://nei.st/medium/caixin/cw893b	面对燎原疫情，信息有限、防护不足、装备不足的一线医护人员怎样倾尽全力，抢救每一条生命	36
2020-02-29	挂钩与脱钩	https://nei.st/medium/economist/of-coupling-and-decoupling	技术发展仍可能导致激烈冲突	36
2020-02-29	由底至顶	https://nei.st/medium/economist/from-bottom-to-top	中国正在逐步向微处理价值链的上游攀登	36
2020-02-29	新三合一	https://nei.st/medium/economist/a-new-trinity	人工智能的成功倚赖优良的数据和廉价的劳动力	36
2020-02-29	懒惰的大脑	https://nei.st/medium/economist/laser-brain	中国人的创造力反映出法律的不足	37
2020-02-29	电动飞跃	https://nei.st/medium/economist/electric-leapfrog	中国从没能精通内燃机。电动车会不一样	37
2020-02-29	反应堆和铁路	https://nei.st/medium/economist/reactors-and-railways	国家帮助核工业和高速列车网络跻身世界一流	37
2020-02-29	香港正出现「失败国家」征兆	https://nei.st/medium/bloomberg/hong-kong-is-showing-symptoms-of-a-failed-state	在这场口罩风波之后，又发生了卫生纸恐慌抢购潮，我们难以想像这种事会发生在任何其他国际金融中心	37
2020-02-29	在即将到来的被称为战争胜利的万人合唱中，让我们默默站到一边，成为一个心里有坟墓的人	https://nei.st/medium/initium/coronavirus-yanlianke	阎连科 2 月 21 日在香港科技大学网络授课的第一讲	37
2020-02-29	我们还没有为下一次全球病毒爆发做好准备	https://nei.st/medium/bloomberg/man-vs-microbe-were-not-ready-for-the-next-global-virus-outbreak	Man vs. Microbe	37
2020-02-29	新型冠状病毒如何影响经济	https://nei.st/medium/bloomberg/the-lasting-toll-of-a-deadly-virus	没有人知道疫情会有多严重，而全球化受到的冲击将久久不散	37
2020-02-29	澳洲山火的启示	https://nei.st/medium/bloomberg/australias-vast-wildfires-foretold-in-2007-un-climate-warning	遗憾的是，这一幕幕惨剧对我们来说将变得越来越司空见惯	37
2020-02-29	美国全民就业的迷思	https://nei.st/medium/bloomberg/even-the-fed-struggles-to-nail-down-the-meaning-of-full-employment	自从在美国经济大萧条期间被提出以来，全民就业一词就一直具有强烈的政治含义	37
2020-02-29	火线救人 50 天	https://nei.st/medium/caixin/cw893a	面对燎原疫情，信息有限、防护不足、装备不足的一线医护人员怎样倾尽全力，抢救每一条生命	37
2020-02-29	当务之急不是社会适应政府，而是政府适应社会	https://nei.st/medium/initium/zhouxueguang-epidemics-state-and-society	社会学家周雪光谈肺炎危机 (下)	38
2020-02-29	中国官僚如何失去了主见和能动性？	https://nei.st/medium/initium/zhouxueguang-epidemics-and-chinese-bureaucracy	社会学家周雪光谈肺炎危机 (上)	38
2020-02-29	「中医抗疫传说」是如何打造的？	https://nei.st/medium/initium/mainland-coronavirus-traditional-chinese-medicine	中国官方推荐的诊疗方案中，有含 4 种强毒性成分的「安宫牛黄丸」，还有传统中医和西医都不认可的中药注射剂	38
2020-02-29	腾讯入股环球唱片：中国音乐产业建立了「文化自信」论述？	https://nei.st/medium/initium/culture-music-industry-tencent-universal	中国音乐市场如何从全世界的反面典型变成世界第七大市场、跻身国际舞台，是一种「大国崛起」吗？	38
2020-02-29	下一个全球大流行病，世界仍将猝不及防	https://nei.st/medium/initium/world-preparedness-to-next-pandemics	世界对于大流行病的准备程度，不在于哪个国家或机构做得最好，而在于那些最脆弱的环节	38
2020-02-29	剃发、哺乳与卫生巾：「抗疫」中，被展演、挪用与牺牲的中国女性身体	https://nei.st/medium/initium/opinion-female-narrative-epidemic	一个女人被裹挟了，她不用知道，也不必知道，她既是主动的，也是被选中的	38
2020-02-29	等待包机的武汉外孙与台北母亲	https://nei.st/medium/initium/taiwan-wuhan-family	两岸间从未止息「战时体制」与「暂时体制」	38
2020-02-29	上岸之后	https://nei.st/medium/caixin/cw890g	长江开启十年禁渔，渔民失去谋生手段，生活如何维持？补贴从哪里来，如何分配？	38
2020-02-29	中国驱逐三名《华尔街日报》记者	https://nei.st/medium/wsj/china-expels-three-wall-street-journal-reporters	这三名记者为《华尔街日报》的新闻部门工作。《华尔街日报》严格区分新闻和观点	38
2020-02-29	疫情肆虐之下，世界向中国关闭大门	https://nei.st/medium/wsj/amid-coronavirus-the-world-closes-its-doors-to-china-i-feel-so-isolated	由于担心新冠病毒疫情扩散，世界切断了与中国的许多联系	38
2020-02-29	俄罗斯能不能没有普京？	https://nei.st/medium/bloomberg/putin-has-a-plan-to-keep-running-russia-without-being-president	普京统治俄罗斯已经超过 20 多年，他不明白的是，俄罗斯将要进入的、恰恰是他将要退出的一个阶段	39
2020-02-29	微信商业化四面出击	https://nei.st/medium/caixin/cw890h	搭建电商新生态、广告寻扩容、整合营销变路径，微信流量的商业化变现之路越发急迫	39
2020-02-29	若放不下对婚姻的贫瘠认知，谈论《婚姻故事》就是浪费	https://nei.st/medium/initium/culture-films-shoot-marriagestory	这部失意于奖项的电影并非要讲婚姻和感情的吊诡，粗暴的感同身受便错过了作品的精彩之处	39
2020-02-29	如何在乱世中创造成长？	https://nei.st/medium/economist/the-world-in-2020/creating-growth-in-a-turbulent-age	世界银行总裁马尔帕斯 (David Malpass) 表示，如果世界各国将重点放在消除经济成长障碍的改革，就可以达到共荣的目标	39
2020-02-29	疫情阴云时的人权律师：新一轮抓捕与新一轮逃亡	https://nei.st/medium/initium/mainland-lawyers-arrested-escape	「比封城更严重的，是封口。」	39
2020-02-29	武汉病人	https://nei.st/medium/initium/coronavirus-patients-no-way-of-hospital	不是所有的故事都能够知道后来的具体走向，在跟踪采访中，有一些人中断了联系，另一些则是记者不忍再去打扰	39
2020-02-29	泄密文件显示维吾尔人被送入新疆再教育营的原因	https://nei.st/medium/wsj/document-shows-chinese-officials-calculations-in-waging-xinjiang-campaign	这份文件聚焦被拘押在墨玉县的 311 个人，让人难得一瞥中国官员在新疆开展他们所称的打击极端主义运动时考虑的因素	39
2020-02-29	渠道传播病毒？关于渠道，你不得不知道的原理和陷阱	https://nei.st/medium/initium/conoravirus-drainage-system	新冠病毒肺炎能否透过粪便传播，至今仍然是谜团，但在疫情阴霾之下，贯穿各户斗室的一条条渠道水管却使人惶恐	39
2020-02-29	消逝的「购物天堂」	https://nei.st/medium/caixin/cw891g	香港零售业正经历最凛冽的寒冬，市场结构性变革，以及半年来的两次「黑天鹅」事件都让往昔辉煌一去不复返	39
2020-02-29	地方攻坚 2020	https://nei.st/medium/cw890f	2019 年四成省份增速不及预期，使 2020 年增长预期普降，推进制造业升级、融入城市群、优化营商环境，是各省份的重要任务	39
2020-02-29	世界经济吹出三大泡沫	https://nei.st/medium/economist/the-world-in-2020/south-sea-stories	300 年前发生的「南海泡沫事件」，投资人还是没学到教训。三大领域可能吹出下一个大泡沫	40
2020-02-29	中国政府把公众的反应当「细菌」，然后拼命地施加抗生素的剂量	https://nei.st/medium/initium/liushaohua-dialogue	「防疫」中国内部，缺乏伦理的医疗技术与政治文化	40
2020-02-29	拯救武汉：实录封城后最艰难的三周	https://nei.st/medium/caijing/edmna6pilviuq572ih6e4a	一座人口过千万的超级大都市在突降灾疫后陷入休克，然后艰难走出混乱无望	40
2020-02-29	习近平称其 1 月 7 日就下令防疫，这意味着什么？	https://nei.st/medium/nytimes/new-timeline-of-events-as-xi-says-he-led-fight-against-virus-early-on	这种新说法可能会让中国数十年来权力最大的领导人直接面临这样的问题：高层领导人是否做得太少、太晚	40
2020-02-29	缺席的领袖身体：关于「亲自」的笑话与灾难中的政治奇观	https://nei.st/medium/initium/opinion-pneumonia-top-leader-absence	他似乎是永远在场又是时常缺席的，高度可见同时高度隐形的，但人们现在发出了这样的疑问：看似掌握着最高权力的领导人，到底能不能做出有效的治理决策？	40
2020-02-29	柴春芽：瘟疫流行时，一个日本社区的生活	https://nei.st/medium/initium/japanese-virus-community-life	这些单独的个人自治体交织而成一个丰富多彩的社区，一种适当距离中的人际协作关系	40
2020-02-29	消费停摆、中小企业告急，疫情令中国经济付出哪些代价？	https://nei.st/medium/initium/mainland-coronavirus-impact-economy	但若照搬 SARS 经验研判今次疫情对经济的影响幅度或程度，恐怕是刻舟求剑	40
2020-02-29	中国经济抗疫	https://nei.st/medium/caixin/cw890e	投资者目前仍在观望，疫情防控进程、信息披露透明度、中国政府将出台哪些相关政策，都将决定资本市场和宏观经济的未来走向	40
2020-02-29	工业：闪击之后	https://nei.st/medium/caixin/cw891e	新冠肺炎疫情威胁到的不仅仅是人们的健康，实体经济也遭受着突如其来的冲击，寒意正浓	40
2020-02-29	认错，悔过：中国控制新疆穆斯林的方式转变	https://nei.st/medium/wsj/admit-your-mistakes-repent-china-shifts-campaign-to-control-xinjiangs-muslims	更为微妙的控制依然存在	40
2020-02-29	消费待重启	https://nei.st/medium/caixin/cw891d	疫情在春节来袭，餐饮、酒旅、影视、商业地产瞬间停摆，若疫情持续三月以上，服务业将遭深重打击	41
2020-02-29	冲击过去再起步	https://nei.st/medium/caixin/cw891c	中国经济经历 2003 年以来的又一次考验	41
2020-02-29	金融战「疫」进行时	https://nei.st/medium/caixin/cw891f	疫情对金融市场的短期冲击已基本释放，下一步信贷倾斜政策如何落实是关键，银行业亦需防范信用风险和道德风险	41
2020-02-29	奥斯卡：变了天地还是换了人间	https://nei.st/medium/caixin/cw892k	每一次剧情的转折推进，每一个场景的张力设计，每一组人物的形象性格，都像是工业流水线上精工细作的结果——精确，却缺乏灵性。这也是好莱坞工业流水线作品的至高复刻，更是奥斯卡最为偏爱的那种优秀但毫无颠覆、挑衅意味的佳作	41
2020-02-29	动物保护，我们落后在哪儿	https://nei.st/medium/caixin/cw892j	在今天新冠肺炎疫情暴发的景况下，我们亟须将尊重生命、爱护弱小、爱护动物的基本理念传达给百姓	41
2020-02-29	楼市暂停以后	https://nei.st/medium/caixin/cw892i	疫情将现金流紧张的房企逼到生死关口，业内期待调控政策松绑	41
2020-02-29	疫情来袭，中国公民意识会重新苏醒吗？	https://nei.st/medium/initium/opinion-china-resistance	走过的人说树枝低了，走过的人说树枝在长	41
2020-02-20	地方求解财政紧平衡	https://nei.st/medium/caixin/cw892h	减税降费影响持续释放、刚性支出不减，叠加疫情冲击，2020 年地方财政收支压力有增无减，如何腾挪？	41
2020-02-20	2019 年财政收入未达目标	https://nei.st/medium/caixin/cw892g	2019 年全国财政收入增速回落至 3.8%，未能实现年初预算安排的 5% 目标增速	41
2020-02-20	艰难的「清零」	https://nei.st/medium/caixin/cw892f	从集中隔离「清零」到应收尽收「清零」，基层社区承担着疫情防控最沉重的压力，也暴露出最复杂的问题	41
2020-02-20	封面报道：保卫湖北	https://nei.st/medium/caixin/cw892a	勾勒湖北防疫战全景，寻找终止疫情的密码	42
2020-02-20	16 城抗疫记录·治理篇	https://nei.st/medium/caixin/cw892e	孝感·鄂州·咸宁·襄阳·潜江	42
2020-02-20	16 城抗疫记录·产业篇	https://nei.st/medium/caixin/cw892d	仙桃·荆门·神农架·十堰	42
2020-02-20	16 城抗疫记录·防控篇	https://nei.st/medium/caixin/cw892c	黄冈·随州·宜昌·荆州·天门·恩施·黄石	42
2020-02-20	16 城抗疫记录	https://nei.st/medium/caixin/cw892b	就在武汉疫情的或明或暗中，各地已陆续与病毒狭路相逢	42
2020-02-20	银行疯了？花钱求你来借钱	https://nei.st/medium/economist/the-world-in-2020/mad-as-a-banker	在欧洲，当个放款者不如当借款者。因为负利率时代，借钱不用还那么多	42
2020-02-20	「钱」景堪忧	https://nei.st/medium/economist/the-world-in-2020/rates-of-decline	大降息时代，银行得准备好面对获利缩水的一年	42
2020-02-20	虚拟货币的关键年	https://nei.st/medium/economist/the-world-in-2020/the-road-to-libraration	就算脸书的虚拟货币 Libra (天秤币) 没有在 2020 年启用，明年依旧会是虚拟货币的关键年	42
2020-02-20	经济要衰退了？别太早下定论！	https://nei.st/medium/economist/the-world-in-2020/recession-dont-bet-on-it	2020 年的一大惊喜，或许是市场氛围会快速回弹	42
2020-02-20	Joey Levin	https://nei.st/medium/bloomberg/the-bloomberg-50/joey-levin	IAC/Interactive Corp. 首席执行官	42
2020-02-20	Robert Smith	https://nei.st/medium/bloomberg/the-bloomberg-50/robert-smith	Vista Equity Partners 董事长兼首席执行官	43
2020-02-20	武汉居民质疑新冠病毒检测试剂盒的准确性	https://nei.st/medium/wsj/at-outbreaks-center-wuhan-residents-question-accuracy-of-virus-tests	根据伦敦帝国理工学院截至 1 月 31 日的估计，每 19 个被感染的武汉人中只有一个得到检测和确诊	43
2020-02-20	中国因抗疫不力罢免迄今级别最高的两名官员	https://nei.st/medium/wsj/china-fires-highest-level-officials-yet-over-coronavirus-outbreak	这是中国到目前为止因防控疫情不力而被免职的最高级别官员。与此同时，美国从武汉撤回的侨民中出现第一例感染病例	43
2020-02-20	校办企业北大方正集团陷入债务危机	https://nei.st/medium/wsj/a-chinese-college-nurtured-a-sprawling-business-empire-then-came-a-debt-crisis	由于积累了大量短期债务，方正集团今年几乎每个月都有一批债券到期，而其巨额房地产投资已将其资金套牢在长期资产上	43
2020-02-20	隔离病房还是感染温床？武汉方舱医院引发专家担忧	https://nei.st/medium/nytimes/warehousing-patients-also-has-its-hazards	「这是一种过时的流行病应对措施，因为你更在乎健康人群，而不是患者。」	43
2020-02-20	多地现社区传播与聚集性疫情，新冠病毒传染力引发警惕	https://nei.st/medium/nytimes/hot-spots-for-virus-are-flaring-from-hong-kong-to-french-alps	中国有近 1000 起聚集性疫情，其中 83% 发生在家庭	43
2020-02-20	Simón Borrero, Sebastian Mejia, Felipe Villamarin	https://nei.st/medium/bloomberg/the-bloomberg-50/simon-borrero-sebastian-mejia-felipe-villamarin	Rappi 公司创办人	43
2020-02-20	Brian Donnelly, aka Kaws	https://nei.st/medium/bloomberg/the-bloomberg-50/brian-donnelly-aka-kaws	艺术家	43
2020-02-20	不一样的新旅人：中国千禧世代	https://nei.st/medium/economist/the-world-in-2020/chinas-new-travellers	携程执行长孙洁认为，中国旅游业成长所带来的巨大利益收益，将不仅体现在经济方面	43
2020-02-20	「就像中世纪的欧洲」：新冠疫情重创中国经济	https://nei.st/medium/nytimes/virus-lockdown-stifles-economy-in-a-wary-china	这个世界上最大的经济体之一仍然基本上处在停摆状态	43
2020-02-20	疫情预警迟到，谁在推卸责任？	https://nei.st/medium/initium/novel-coronavirus-nhc-vs-cdc	从地方政府到中央机构，上演了一场「击鼓传锅」	44
2020-02-20	脱欧之后	https://nei.st/medium/caixin/cw891b	过去三年半的脱欧进程已经一波三折，未来 11 个月的过渡期谈判依旧不会平静	44
2020-02-20	欧盟将要想念英国	https://nei.st/medium/bloomberg/the-european-union-is-going-to-miss-the-u-k-when-its-gone	英国已于 1 月 31 日正式脱欧，即使还有近 11 个月的过渡期谈判	44
2020-02-20	习近平在疫情爆发后首次前往一线视察	https://nei.st/medium/nytimes/xi-on-beijing-front-line-lets-not-shake-hands	证据非常清楚地表明了坠机可能并且可信的原因	44
2020-02-20	Kylie Jenner	https://nei.st/medium/bloomberg/the-bloomberg-50/kylie-jenner	Kylie Cosmetics 首席执行官	44
2020-02-20	Bhushan Kumar	https://nei.st/medium/bloomberg/the-bloomberg-50/bhushan-kumar	T-Series 董事长	44
2020-02-20	要如何在沙漠种植生菜？	https://nei.st/medium/economist/the-world-in-2020/farming-on-the-rise	与室外种植相较，这间垂直农场的用水量减少了 99%	44
2020-02-20	「消失」的习近平：新冠疫情可能对中国政局产生何种影响	https://nei.st/medium/nytimes/china-in-crisis-xi-backs-away-from-spotlight	习近平告诉世界卫生组织总干事谭德塞他「亲自指导」了政府应对疫情的工作。官媒在后来的报道中没有用这个说法。因为官媒报道习近平时的用词从来都不是偶然的，这个小改动暗示了强调共同责任的刻意做法	44
2020-02-20	谁是美中贸易战的受益者？	https://nei.st/medium/wsj/u-s-china-trade-war-reshaped-global-commerce	让我们来看看那些在全球贸易体系中趁机补缺的经济体	44
2020-02-20	习近平不仅要打疫情战，还要应对政治危机	https://nei.st/medium/wsj/chinas-leader-wages-a-war-on-two-fronts-viral-and-political	面对新冠病毒疫情，中国国家主席习近平动员了庞大的国家机器，一方面旨在抗击该疫情，另一方面也是为了抑制自 2012 年他上台以来最炽烈的公众怒火	44
2020-02-20	Ramon Ang	https://nei.st/medium/bloomberg/the-bloomberg-50/ramon-ang	生力集团 (San Miguel) 主席	45
2020-02-20	Mette Frederiksen	https://nei.st/medium/bloomberg/the-bloomberg-50/mette-frederiksen	丹麦首相	45
2020-02-20	机器人无法取代的「南丁格尔」	https://nei.st/medium/economist/the-world-in-2020/florence-and-the-machine	2020 年是南丁格尔 200 岁冥诞，也被 WHO 订为「护理年」，凸显全球护理师的潜力和挑战	45
2020-02-20	奥斯卡前夕预测：「老白男」能度过外强中干的转型期吗？	https://nei.st/medium/initium/oscar-preview-2020	群众对美国的孺慕之情已然在淡去，美国在音乐与影像上的领先地位慢慢被动摇，美国影坛过去最强大的造梦能力也被众多平台与资金分散所影响	45
2020-02-20	Hong Kong protesters	https://nei.st/medium/bloomberg/the-bloomberg-50/hong-kong-protesters	香港的示威者	45
2020-02-20	个人飞行器升空	https://nei.st/medium/economist/the-world-in-2020/lift-off	飞行车不是梦！小型个人电动飞行器，即将问世	45
2020-02-20	Popeyes’ fried chicken sandwich	https://nei.st/medium/bloomberg/the-bloomberg-50/popeyes-fried-chicken-sandwich	大力水手炸鸡 (Popeyes) 的炸鸡汉堡	45
2020-02-20	抢救新冠病人	https://nei.st/medium/caixin/cw891a	全中国重症医学人员云集武汉，降低死亡率的阻击战进入关键时分，医生在做什么？危重病人靠什么活下来？缓解问题的关键在哪里？	45
2020-02-20	当无处可逃时，我们无法再逃离这个时代	https://nei.st/medium/initium/pneumonia-diary-huanggang	我希望大家的愤怒可以保持得更久一些，不要疫情一结束就什么都忘了	45
2020-02-20	从香港到武汉，对抗系统性败坏	https://nei.st/medium/initium/opinion-hk-2019-ncov-china	香港人和武汉市民所面对的，其实是同一专制带来的恶果	45
