Year	Headline	Link	Intro	Page
2019-11-10	香港离奇出现「大理石泡沫」	https://nei.st/medium/wsj/a-mysterious-marble-bubble-in-hong-kong	已经亏损两年的中国大理石矿企雅高控股在今年累计上涨 3,800% 后，本月被纳入 MSCI 明晟中国指数	29
2019-10-31	经济减速和通胀上升令中国央行束手束脚	https://nei.st/medium/wsj/chinas-slowing-economy-rising-inflation-handcuff-central-bank	中国央行周三小幅下调 LPR，但中国的体系更多地依赖政府指导下的贷款分配	29
2019-10-31	中国成立 210 亿美元国家制造业转型升级基金，或招致美国不满	https://nei.st/medium/wsj/chinas-new-21-billion-high-tech-manufacturing-fund-likely-to-rankle-u-s	该计划的明确目标是发展先进技术，同时将外国公司排除出中国的此类市场	29
2019-10-31	中国召见美驻华外交官，抗议美国通过涉港法案	https://nei.st/medium/wsj/beijing-summons-u-s-diplomat-to-protest-support-for-protesters	中国政府一直在指责西方政府煽动香港骚乱，而参议院的法案为北京方面提供了一个机会	29
2019-10-31	香港与中央似乎没有一个好好的沟通渠道	https://nei.st/medium/initium/hongkong-anson-chan-fang-on-sang	专访陈方安生	30
2019-10-31	新经济带来的冲击	https://nei.st/medium/bloomberg/the-shocks-of-the-new-economy	新经济特刊	30
2019-10-31	利用世界上最大的聚变反应堆追求无限的能源	https://nei.st/medium/bloomberg/temple-of-the-sun	世界上的大国虽然无法在应对气候变化上达成部份共识，但它们正信心满满地在法国南部进行合作	30
2019-10-31	全球生育率崩溃	https://nei.st/medium/bloomberg/global-fertility-crash	随着出生率下降，各国将被迫作出政策调整，否则将被其他国家赶上	30
2019-10-31	塑料银行	https://nei.st/medium/bloomberg/paying-with-plastic	将塑料重新定义为一种货币	30
2019-10-31	印度银行陷入坏帐风暴	https://nei.st/medium/bloomberg/indias-stressed-banks	在全球主要经济体中，印度银行的不良贷款相对于贷款总额的比例是最高的	30
2019-10-31	超级行人专用区	https://nei.st/medium/bloomberg/the-walking-city	不是不建，而是到处都建	30
2019-10-31	赞比西河的艰苦生活	https://nei.st/medium/bloomberg/a-hard-life-on-the-river	随着全球气候暖化的加剧，赞比西河流域和世界其他贫困的海滨和河滨区域面临的风险不断增长	30
2019-10-31	驱动和干扰：一个新经济指数	https://nei.st/medium/bloomberg/drivers-and-disrupters	从上调的关税到上升的气温，中低收入经济体在努力追随日本和南韩等成功先例走向繁荣的道路上面临新挑战	30
2019-10-31	移民几何	https://nei.st/medium/bloomberg/calling-all-strivers	对那些一夜之间卷入资本主义洪流的人来说，现实是残酷的	30
2019-10-31	弹劾特朗普会成功吗	https://nei.st/medium/caixin/cw880d	按弹劾程序，明年初参议院才可能开始正式的弹劾审判，结果很可能是弹劾失败，希望特朗普下台应该靠 2020 年大选	31
2019-10-31	停滞不前的美中贸易谈判可能再次陷入僵局	https://nei.st/medium/wsj/stalled-u-s-china-trade-talks-raise-threat-of-another-impasse	班农说：「这些谈判中唯一不变的是中国会反悔和食言，而特朗普坚守着自己的原则——他的关税举措至关重要。」	31
2019-10-31	中国政府最新举动对香港司法独立构成挑战	https://nei.st/medium/wsj/beijing-move-poses-challenge-to-independence-of-hong-kongs-judiciary	北京的声明并不明确，但可以被解读为完全反对香港法院的运作方式	31
2019-10-31	水环境标准艰难重订	https://nei.st/medium/caixin/cw880e	继空气和土壤环境质量标准修订之后，严重超期服役的水标准亟待重新修订，完成十多年未竟的艰巨工程	31
2019-10-31	美国参议院通过香港人权法案	https://nei.st/medium/nytimes/senate-bill-hong-kong-protests	该法案在理论上得到了确保否决无效的国会多数人的支持，即使遭到特朗普的否决，它也可以成为法律	31
2019-10-31	生猪复养背后的金融难题	https://nei.st/medium/caixin/cw880b	政府和保险公司共同分担风险的模式有待完善，生猪保险产品亟待创新，补贴及贷款优惠等金融支持政策尚难惠及中小养猪场及散户	31
2019-10-31	煤制氢路径争议	https://nei.st/medium/caixin/cw880c	煤炭大省山西欲转型「氢谷」，但看似成本低廉的煤制氢路径却充满争议和障碍	31
2019-10-31	中国回应《纽约时报》新疆报道	https://nei.st/medium/nytimes/china-calls-crackdown-an-attack-on-terrorism	「完全是境内外敌对势力内外勾结杜撰的，一派胡言、谎话连篇、用心险恶」	31
2019-10-31	中国中小型银行为何步履蹒跚？	https://nei.st/medium/wsj/why-chinas-smaller-banks-are-wobbling	经过数年的高速发展后，中国一些小型和中型银行开始出现问题。没有一家小银行会构成系统性威胁，但可能与更大的机构有关联	31
2019-10-31	接管包商银行	https://nei.st/medium/caixin/cw857a	年来第一家被监管接管的商业银行，市场关注的是，有限打破同业刚兑之后，会带来什么样的深远影响？	31
2019-10-31	网络掘金下南洋	https://nei.st/medium/caixin/cw880a	独角兽企业在东南亚成批崛起。中国互联网资本与模式，如何加入这 6 亿人市场的大战局？	32
2019-10-31	香港警方冲进香港理工大学，试图从抗议者手中夺回校园	https://nei.st/medium/wsj/hong-kong-police-try-to-storm-university-in-bid-to-retake-campus-from-protesters	外一则：香港高等法院裁定禁蒙面法违宪	32
2019-10-31	「毫不留情」：超过 400 页的泄露文件揭示中国如何组织对穆斯林大规模拘禁	https://nei.st/medium/nytimes/absolutely-no-mercy-leaked-files-expose-how-china-organized-mass-detentions-of-muslims	403 页中国政府内部文件详细说明了该国如何在新疆镇压穆斯林和少数民族。官员们秘密策划镇压行动并使其正当化，即使他们在公共场合淡化这一问题	32
2019-10-31	全球化的挑战需要全球化的应对	https://nei.st/medium/caixin/cw879g	全球经济进入衰退的可能性较低，但政策应对空间狭小，多种措施应谨慎部署	32
2019-10-31	最长煤运专线「生不逢时」	https://nei.st/medium/caixin/cw879h	耗资近 2000 亿元的煤运专线，一经投运即面临着货源缺乏、需求不足、竞争激烈、调度复杂等多重困境，市场期待能够出现更加灵活的机制，使得这条铁路冲出重围	32
2019-10-31	「冷战」棋局下的柏林墙	https://nei.st/medium/caixin/cw879k	从东西方「冷战」前哨的角度看，柏林墙带来许多麻烦，但至少让直接的冲突越来越少，这正是西方盟国的政客们最初消极对待柏林墙的原因	32
2019-10-31	生命之问	https://nei.st/medium/caixin/cw879j	生命的起源如果没有神性在其中，多少让人怅然若失，不过再想想,无论 38 亿年前的下午发生了什么， 也不会改变我们现在的生活和价值	32
2019-10-31	致命长途车	https://nei.st/medium/caixin/cw879f	导致 36 人死亡的惨烈事故过后，安徽、河南两地掀起了监管风暴。无证长途大客车跨省挂靠运营的顽疾，能否根除？	32
2019-10-31	星港「钱途」	https://nei.st/medium/caixin/cw879i	中国香港面临的社会困局令财富开始流向竞争对手，但新加坡并未因此窃喜，两地仍需谨慎思考未来各自在区域中的地位	32
2019-10-31	康得新救赎之路	https://nei.st/medium/caixin/cw879e	退市、重组还是破产重整，「披星戴帽」已有时日的康得新有着 15 万股东和众多债权人，博弈仍在持续	32
2019-10-31	「泰坦尼克」撞上「兴登堡」	https://nei.st/medium/wsj/bearish-hindenburg-and-titanic-indicators-flash-stock-market-warning	本周，「兴登堡凶兆」和「泰坦尼克综合症」技术指标同时发出预警信号，这两项指标双双闪灯是一个非同寻常的现象	33
2019-10-31	交通瘫痪、学校停课、经济衰退：香港之伤能否愈合	https://nei.st/medium/nytimes/unrest-upends-special-traits-of-hong-kong	警方打破了不入校园的不成文规矩，向校园发射催泪弹和橡胶子弹，学生则投掷燃烧弹和砖块。大学校园成了被围困的中世纪城堡	33
2019-10-31	潜意识真的存在吗？	https://nei.st/medium/southern/nfzm-1864e	人们常说是潜意识主导了我们的心智和行为，这种观念又被迅速发展的人工智能所激化，因为人工智能完全没有意识，却能在围棋、国际象棋等领域中表现出超越人类的水准	33
2019-10-31	强人之变	https://nei.st/medium/southern/wang-shi-y32dns0woqtmcmwlcxqcvw	他尊重时间在他身上的反应	33
2019-10-31	比较中的鼠药	https://nei.st/medium/southern/nfzm-1864d	国家为什么会失败	33
2019-10-31	把时间带走，把切尔诺贝利留下	https://nei.st/medium/southern/nfzm-1864c	亲身探访闭合了所有关于切尔诺贝利的想象碎片，拼出了这场史无前例灾难的面貌	33
2019-10-31	砂荒的秘密	https://nei.st/medium/southern/nfzm-1864b	「一平方米房子需要 800 公斤，一公里高速需要 7 万吨，一公里高铁需要 8 万吨。」	33
2019-10-31	「不是 30 比索，而是 30 年」	https://nei.st/medium/southern/nfzm-1864a	按照世界银行的标准，智利已进入发达国家的行列。如今，它却被区区 30 比索 (约合人民币 3 角) 骤然压垮	33
2019-10-31	中大「战事」	https://nei.st/medium/initium/hongkong-cuhk-protest-police	在夜里奔赴中大的人们抱著这样一个想法：「如果中大守不住，香港都守不住了。」	33
2019-10-31	从避难所变成战场，暴力深入香港大学校园	https://nei.st/medium/nytimes/hong-kong-colleges-go-from-sanctuaries-to-citadels	警方打破了不入校园的不成文规矩，向校园发射催泪弹和橡胶子弹，学生则投掷燃烧弹和砖块。大学校园成了被围困的中世纪城堡	33
2019-10-31	字里行间寻幸福	https://nei.st/medium/economist/reading-between-the-lines	书籍揭示了一个国家国民幸福感的历史变化	34
2019-10-31	说你多幸福，你就多幸福	https://nei.st/medium/economist/the-pursuit-of-happiness	一本新书探讨为何中国人不像国家经济成功所预示的那么开心	34
2019-10-31	完美的未来	https://nei.st/medium/economist/a-future-perfect	史蒂芬·平克在其振奋人心的新书中指出，因为人们能够理性思考，所以生活将持续向好	34
2019-10-31	中国严禁大麻，但让大麻产业蓬勃发展	https://nei.st/medium/wsj/china-says-no-to-marijuana-but-lets-its-cannabis-industry-bloom	中国农户正在增加大麻的种植，中国正全速进军大麻二酚行业	34
2019-10-31	健康险增长背后	https://nei.st/medium/caixin/cw879d	短期数据的快速增长与市场的高度关注并不代表产品的成功，合理有效地均衡各方利益与诉求才是产品发展的关键	34
2019-10-20	科技巨头与反垄断：如何拆除垄断	https://nei.st/medium/economist/how-to-dismantle-a-monopoly	拆分科技巨头有无可能？如果有，真的会发生吗？	34
2019-10-20	对华关税问题成中美贸易协议绊脚石	https://nei.st/medium/wsj/tariffs-on-china-imports-emerge-as-hurdle-to-trade-deal	特朗普说，「我们是决定是否想要达成协议的人。」	34
2019-10-20	金融纾困民企一年检视	https://nei.st/medium/caixin/cw879c	曾被纾困过的企业，有些借力纾困成功上岸，有的还在负重跋涉。纾困政策不能忽视市场规律，金融机构不可偏离审慎原则	34
2019-10-20	捡树枝	https://nei.st/medium/economist/pick-a-stick	机器人识别和操控物品的能力正在提高	34
2019-10-20	故事风险	https://nei.st/medium/economist/tale-risk	故事如何影响盛衰交替	34
2019-10-20	亚马逊大举招募中国卖家，置消费者和其他卖家于度外	https://nei.st/medium/wsj/amazons-heavy-recruitment-of-chinese-sellers-puts-consumers-at-risk	电子商务平台包含了违禁，不安全，标签错误的产品。原因之一：它呼吁中国的制造商直接向美国销售	35
2019-10-20	难防宫颈癌	https://nei.st/medium/caixin/cw879b	宫颈癌免费筛查项目已十年，却未能阻挡发病率提升，为什么？	35
2019-10-20	柏林墙倒塌 30 年后的德国	https://nei.st/medium/bloomberg/thirty-years-after-the-berlin-wall-fell-the-battle-for-german-unity-still-rages	对那些一夜之间卷入资本主义洪流的人来说，现实是残酷的	35
2019-10-20	下一场商业革命	https://nei.st/medium/economist/the-next-business-revolution	美国商学院正在重塑 MBA 课程，是时候了	35
2019-10-20	时间到	https://nei.st/medium/economist/times-up	世界上最古老、最庞大、最复杂的连串存根记录即将被撕碎	35
2019-10-20	集思广益	https://nei.st/medium/economist/second-thoughts	鼓励各抒己见于公司有利	35
2019-10-20	柏林墙倒塌 30 年：改变世界的一场意外	https://nei.st/medium/nytimes/berlin-wall-photos-30-year-anniversary	没有一声枪响、没有苏联的坦克，这不是精心策划的的地缘政治交易的结果，而是人为过失、自发性和个人勇气作用下的奇妙之作	35
2019-10-20	冲突升级，香港警察向抗议者开枪	https://nei.st/medium/wsj/hong-kong-police-shoot-protester-during-citywide-clashes	一名中枪男子接受了紧急手术。在示威者试图阻塞道路并延误列车运行后，香港周一的交通陷入混乱	35
2019-10-20	卡洛斯精神	https://nei.st/medium/economist/the-spirit-of-carlos	麻烦重重的汽车产业能从一个伟大的欧洲汽车公司老板那里学到什么	35
2019-10-20	宇宙之王	https://nei.st/medium/economist/masters-of-the-universe	忘了戈登·盖柯吧。计算机正在逐渐统领金融市场	35
2019-10-20	风马牛不相及	https://nei.st/medium/economist/chalk-and-cheese	准备上市的爱彼迎急于指出自己与优步的不同	36
2019-10-20	「共享经济」滑铁卢	https://nei.st/medium/caixin/cw879a	全球最新一轮共享经济巨头正在经受华尔街严酷考验，滴滴、OYO 的估值故事难以延续，投资人正吞下挥金如土的苦果	36
2019-10-20	大而不透明：谷歌如何打造出全球主导的广告机器？	https://nei.st/medium/wsj/how-google-edged-out-rivals-and-built-the-worlds-dominant-ad-machine	谷歌庞大且不透明的广告机器是如何工作的？为什么出版商和竞争对手对它有如此多的抱怨？	36
2019-10-20	一个与中国关系密切的斯里兰卡政治家族试图重新掌权	https://nei.st/medium/wsj/sri-lankan-clan-with-close-china-ties-plots-political-comeback	这个家族曾让斯里兰卡成为中国寻求在亚洲扩大影响力的一系列努力的核心，还挫败过一场叛乱	36
2019-10-20	中国宣称美中同意取消加征关税，但仍有人心存疑虑	https://nei.st/medium/wsj/china-claims-tariffs-will-go-but-others-express-doubts	美国没有回应，而且从特朗普政府内部传出的消息来看，对于是否致力于降低关税还有互相矛盾的意见	36
2019-10-20	P2P 最后时刻：交了上万亿学费，不留下点什么吗？	https://nei.st/medium/southern/nfzm-1863d	等于把淤泥底下的东西都铲了上来，里面能挖着莲藕，也有臭鱼烂虾	36
2019-10-20	巴格达迪之死	https://nei.st/medium/southern/nfzm-1863c	IS 有了一个新的领导人，我们知道他是谁	36
2019-10-20	争夺剑南春：八年前一起贪腐案，令改制往事沉渣泛起	https://nei.st/medium/southern/nfzm-1863b	剑南春的商标、品牌不属于剑南春	36
2019-10-20	人类最大的威胁	https://nei.st/medium/southern/nfzm-1863a	她们杀死了历史上大约一半的人口	36
2019-10-20	韩少功 ：很想特别乡土 ，又特别先锋	https://nei.st/medium/southern/han_shaogong-shx0naqoe2clzjdvgbsewg	「这是中西文化的一个大碰撞的时代。当时我们很多同行，学苏俄，学海明威，学卡夫卡，写得很像，但在文章里面，我把他们讽刺为『移植外国样板戏』，很不以为然。我觉得艺术需要个性，一个民族的文化也需要个性」	36
2019-10-20	隔岸斗法：重整旗鼓的金鸡奖会超越金马奖吗？	https://nei.st/medium/initium/culture-jjj-china	向来式微的金鸡，这一次由于承载起民间的爱国情愫，而被寄予了对标金马的厚望	37
2019-10-20	为中国辩解，蔡崇信在 NBA 风波中惹恼美国人	https://nei.st/medium/wsj/new-nets-owner-joe-tsais-views-on-china-bring-u-s-backlash	这位阿里巴巴联合创始人关于 NBA 风波的言论让一些美国人愤怒，但他认为自己代表了中国人的看法	37
2019-10-20	解构「福建帮」：从联谊乡亲到政治动员的铁军	https://nei.st/medium/initium/hongkong-fujian-associations-analysis	被中央领导誉为「嫡系部队」和「铁军」的香港福建社团，究竟是怎样的组织？	37
2019-10-20	中国以美国式破产缓冲经济放缓压力	https://nei.st/medium/wsj/china-embraces-bankruptcy-u-s-style-to-cushion-a-slowing-economy	中国的破产制度借鉴了美国破产法第十一章的条款，但在破产程序方面，中国还需要在较短时间内做大量功课	37
2019-10-20	雾霾指标暗示中国建筑业走软	https://nei.st/medium/wsj/chinas-smog-gauge-is-signaling-trouble	越来越多的研究暗示，在缺乏深层次机构和金融行业改革的情况下，一定程度的贪腐活动实际上可能对中国的经济增长模式十分重要	37
2019-10-20	中国的腐败悖论：反腐运动是否在削弱中国经济增长？	https://nei.st/medium/wsj/chinas-corruption-paradox	越来越多的研究暗示，在缺乏深层次机构和金融行业改革的情况下，一定程度的贪腐活动实际上可能对中国的经济增长模式十分重要	37
2019-10-20	少储蓄、多借债，中国人的金钱观越来越像美国人	https://nei.st/medium/wsj/less-savings-more-debt-how-chinese-manage-money-american-style-in-17-charts	随着贷款买房和生活方式升级成为潮流，中国人勤俭持家的习惯受到侵蚀，这样的世代变迁势必会对全球经济造成影响	37
2019-10-20	宁德时代如何崛起为电动汽车电池行业主导者？	https://nei.st/medium/wsj/the-key-to-electric-cars-is-batteries-one-chinese-firm-dominates-the-industry	中国打造了全球最大的电动汽车市场，并且施压外国汽车制造商使用中国产电池。名不见经传的宁德时代由此成为全球最大的电动汽车电池生产商	37
2019-10-20	沙特阿美启动期待已久的 IPO	https://nei.st/medium/wsj/saudi-aramco-launches-long-awaited-ipo	沙特阿美周日正式启动 IPO，预计这将是全球有史以来规模最大的股票发行交易	37
2019-10-20	中国首个阿尔兹海默新药为何令业内谨慎业外热情？	https://nei.st/medium/caixin/ixv4dwpjo	时隔 17 年才终于又有阿尔兹海默病新药上市，而药品来自中国，披露的数据引来业内人士的疑问	37
2019-10-20	中国式卡车司机文化	https://nei.st/medium/economist/trucker-culture-china-style	中国 3000 万长途司机默默无闻，少人称颂。来搭一次便车看看	38
2019-10-20	香港还有多少地？	https://nei.st/medium/caixin/cw878e	特区政府决心启动大规模收回私人土地政策，能否解香港土地供应之渴	38
2019-10-20	自主之路	https://nei.st/medium/economist/autonomous-ways	通向无人驾驶汽车的道路漫长而曲折。中国正在走一条与西方不同的路	38
2019-10-20	冉冉升起的新星	https://nei.st/medium/economist/a-rising-star	中国的制药业正在不断壮大	38
2019-10-20	丙肝药大杀价	https://nei.st/medium/caixin/cw878d	大幅降价、纳入医保取得重大进展，但消灭丙肝还缺一套自上而下的整体干预战略	38
2019-10-20	未成年的暴力	https://nei.st/medium/caixin/cw878c	《预防未成年人犯罪法》的修订能否回应社会的焦虑？	38
2019-10-20	全球「新销烟运动」	https://nei.st/medium/caixin/cw878b	美国电子烟相关病情爆发，监管博弈的天平正在出现变动	38
2019-10-20	电子烟何处去	https://nei.st/medium/caixin/cw878a	外贸内销双双暴涨，恰逢全球监管收紧，改变行业格局的中国电子烟走到十字路口	38
2019-10-20	中国的「海上丝绸之路」：防御是最好的进攻	https://nei.st/medium/economist/the-best-offence-is-a-good-defence	中国的海外港口建设有助于保护现有贸易路线	38
2019-10-20	前路迷茫	https://nei.st/medium/economist/foggy-outlook	贸易战一波三折，损害增长	38
2019-10-20	我行我「速」	https://nei.st/medium/economist/your-own-risc	一种新的微处理器设计正在挑战行业巨头	39
2019-10-20	热情受抑	https://nei.st/medium/economist/enthusiasm-curbed	Netflix 和 HBO 受到观众喜爱，投资者却坐不住了	39
2019-10-20	阿密特下山	https://nei.st/medium/southern/a-mei-chang-6noxscszbeek04kcehugop	她坚持「我对音乐绝对诚实」，22 年里，这种诚实赤裸而直接，又因她的嗓音本钱和几乎集全华语乐坛之力培养出的音乐表现力而极易引发强大共鸣	39
2019-10-10	企业家的新装	https://nei.st/medium/economist/the-entrepreneurs-new-clothes	一些风险资本家活在一个虚构的世界里。好在还有股市	39
2019-10-10	世茂为何不缺钱？	https://nei.st/medium/southern/nfzm-1862c	世茂在三四线城市新增建面超过前 4 年的总和	39
2019-10-10	谁杀死了莲花味精？	https://nei.st/medium/southern/nfzm-1862d	巅峰时期，莲花味精产量居世界第一，国内市场占有率高达 43.4%，难觅对手	39
2019-10-10	统编小学语文教材中的争议与回应	https://nei.st/medium/southern/nfzm-1862e	人教版、苏教版、北师大版、湘教版等十余种版本教材不再，如今「统编本」一统江湖	39
2019-10-10	英国「死亡货车」背后的人口走私链	https://nei.st/medium/southern/nfzm-1862b	15 岁越南偷渡少年阮辉雄的死亡之旅	39
2019-10-10	淘集集，逃集集	https://nei.st/medium/southern/nfzm-1862a	一个「比拼多多便宜三毛钱」，「跑得太快」的失败故事	39
2019-10-10	机器不会毁灭我们，是我们自己毁灭自己——《终结者》系列电影的 35 年	https://nei.st/arts/movies/nfzm-1862f	只不过，我们将用机器来做到这一点	39
2019-10-10	至高成就	https://nei.st/medium/economist/supreme-achievement	对于一个容易被炒作的领域，量子计算能力的展示是一个决定性时刻	40
2019-10-10	中国取消独生子女政策仍难扭转出生率下降趋势	https://nei.st/medium/wsj/china-left-one-child-policy-behind-but-it-still-struggles-with-a-falling-birth-rate	中国已是世界上生育率最低的国家之一，而且中国人口问题比原本以为的还要严峻	40
2019-10-10	抗议活动拖累香港陷入衰退，复苏遥不可见	https://nei.st/medium/wsj/hong-kong-protests-force-city-into-recession-with-no-recovery-in-sight	香港现在已正式陷入经济衰退	40
2019-10-10	习近平显然毫发无损	https://nei.st/medium/wsj/chinas-communist-party-concludes-conclave-in-strong-support-of-xi	中共十九届四中全会闭幕，习近平的领导地位得到坚决拥护	40
2019-10-10	富裕经济学	https://nei.st/medium/economist/rich-economics	三位经济学家凭借对贫困问题的开创性研究获得诺贝尔奖	40
2019-10-10	办公场所的未来	https://nei.st/medium/economist/redesigning-the-office	一探伦敦的三座新写字楼，了解办公室正如何被重构	40
2019-10-10	正在改建	https://nei.st/medium/economist/work-in-progress	WeWork 败退，白领面对双层式办公室制度	40
2019-10-10	非一般雪地马球赛	https://nei.st/medium/bloomberg/winters-wild-ride	为了一年一度的雪地马球赛，全球各地的私人飞机云集瑞士度假小镇圣莫里茨	40
2019-10-10	「死亡运河」如何活下来？	https://nei.st/medium/bloomberg/the-canal-of-death-is-now-an-economic-gateway-for-eastern-europe	这条运河曾是压迫与极权主义虚华的象征，如今则成为了国家转型的例证	40
2019-10-10	攻陷美国的牛油	https://nei.st/medium/bloomberg/irish-butter-kerrygold-has-conquered-americas-kitchens	Kerrygold 的牛油已经征服了美国人的厨房，因为它来源自只吃青草的爱尔兰奶牛以及出色的行销策略	40
2019-10-10	习近平新时代，中国的耐克能否走向全球？	https://nei.st/medium/bloomberg/can-the-nike-of-china-go-global	北京与 NBA 之间的风波登上了新闻头条。但中国真正重要的体育故事，是安踏能否实现全球业务扩张	41
2019-10-10	中国科技界的失落一代	https://nei.st/medium/bloomberg/chinas-lost-tech-generatio	随着职位流失与日俱增，科技初创企业员工开始抵制超时工作文化	41
2019-10-10	菲亚特克莱斯勒汽车和标致雪铁龙同意合并	https://nei.st/medium/wsj/fiat-chrysler-and-peugeot-owner-psa-agree-to-merge	如果两家公司的董事会批准，将创建全球销量第四大汽车制造商，市场价值超过 484 亿美元	41
2019-10-10	基因疗法背后的另类试验	https://nei.st/medium/bloomberg/stop-stabbing-yourself	对于生物黑客 (biohacker) 来说，要吸引那些对基因疗法噱头不感兴趣的人是一个挑战	41
