Year	Headline	Link	Intro	Page
2020-01-10	通用汽车在华销量出现有史以来最大降幅	https://nei.st/medium/wsj/gm-posts-its-biggest-china-sales-decline	中国市场已成为国内外众多汽车厂商的棘手问题	70
2020-01-10	手机厂商「软硬兼施」	https://nei.st/medium/caixin/cw887f	硬件进入存量用户争夺时代，手机厂商纷纷加码互联网服务，寻找新的收入增长点，巩固护城河。但其互联网服务能否突破硬件销量天花板？	70
2020-01-10	寓教于演	https://nei.st/medium/economist/bartleby/conduct-yourself	企业能从人文艺术中学到什么	70
2020-01-10	中国人会购买人造肉吗？	https://nei.st/medium/nytimes/impossible-dumplings-and-beyond-buns-will-china-buy-fake-meat	在中国不断壮大的中产阶级中，许多消费者认为肉是一个重要的地位象征，他们对肉食的烹饪方式也有着与美国人截然不同的预期	70
2020-01-10	大受欢迎，直到免费试用期结束	https://nei.st/medium/bloomberg/cord-cutters-love-to-watch-until-the-free-trials-expire	只有约三分之一的用户选择继续使用	70
2020-01-10	负利率催生资产泡沫？	https://nei.st/medium/bloomberg/a-funny-thing-happened-on-the-way-to-the-stock-market-record	在负利率环境下追求回报率不是一件容易的事	70
2020-01-10	苏莱曼尼之死对伊朗人意味着什么	https://nei.st/medium/nytimes/the-day-after-war-begins-in-iran	为这位将军的哀悼是伊朗的首个报复行动	70
2020-01-10	云市场争夺战升温，霸主亚马逊多阵线严防对手反扑	https://nei.st/medium/wsj/amazon-has-long-ruled-the-cloud-now-it-must-fend-off-rivals	在规模达 2,660 亿美元的云计算市场，亚马逊面临的竞争日益加剧，微软等对手试图获得更大的市场份额	70
2020-01-10	去非洲种大米	https://nei.st/medium/caixin/cw887d	非洲国家农业体系不健全，从种植到销售，每个环节都是破损的。全产业链投资考验中国企业的实力和耐性	70
2020-01-10	武汉「不明原因肺炎」排除 SARS，2003 年后中国建立了怎样的监测体系？	https://nei.st/medium/initium/mainland-wuhan-pneumonia	截至 1 月 5 日，武汉共出现不明原因病毒肺炎 59 例，其中重症 7 例，暂无死亡案例	70
2020-01-10	中国卫生部门试图查明武汉不明原因肺炎的病原	https://nei.st/medium/nytimes/china-eager-to-calm-a-nervous-public-grapples-with-mystery-illness	武汉不明原因病毒性肺炎已确认感染 59 人﹐香港和新加坡也为此发布了健康警报。 中国卫生部门虽然已经排除了 SARS、中东呼吸综合症、流感、禽流感和腺病毒感染﹐但仍处于查找病原的过程中	71
2020-01-10	特朗普连任的筹码	https://nei.st/medium/bloomberg/dont-look-now-but-things-are-getting-brighter-for-trump	弹劾可能实际上对特朗普有利	71
2020-01-10	美元比你以为的还要重要	https://nei.st/medium/wsj/the-dollar-is-even-more-important-than-you-know	当你听说美元在国际金融中的重要性可能下降时，别忘了那些被视而不见的份额	71
2020-01-10	槟城可能是贸易战赢家	https://nei.st/medium/bloomberg/the-trade-war-may-help-penang-return-to-its-glory-days	「我觉得，这场贸易战是我们的福气。」	71
2020-01-10	态度大逆转，亚马逊进军混合云市场	https://nei.st/medium/bloomberg/amazon-turns-to-cloud-hardware-to-outrun-microsoft-and-google	曾经向新客户赠送锤子供他们砸碎本地服务器的亚马逊，如今向这一领域进军，有点像是苹果公司在推销老式的转盘拨号固定电话	71
2020-01-10	汇丰在香港陷入争议	https://nei.st/medium/wsj/hsbc-grapples-with-controversy-in-hong-kong	汇丰作为香港最大的零售银行，被很多当地人视为香港社会的一部分，抗议者对于破坏该行的行为看法不一	71
2020-01-10	量子计算仍然是科技公司的挑战	https://nei.st/medium/wsj/quantum-computing-remains-a-challenge-for-tech-firms	尽管在证明量子计算的潜力方面已取得一些进展，但目前在实验室进行的许多计算都可以用传统计算机更快速地完成	71
2020-01-10	看钱不看人	https://nei.st/medium/economist/for-the-money-not-the-few	忍着吧。全球最傲慢的理财公司正被迫为底层大众服务	71
2020-01-10	中美第一阶段谈判成果不涉及增加粮食进口配额	https://nei.st/medium/caixin/izzkipgfcsg	中农办副主任韩俊表示，玉米、小麦、大米配额不会调整。这是全球配额，不会为了一个国家调整	71
2020-01-10	骆惠宁出任香港中联办主任，中央治港方针或趋强硬	https://nei.st/medium/wsj/beijing-shakes-up-hong-kong-front-office-signaling-tougher-tack-on-protests	表明北京方面的首要任务是把自己的意愿强加给香港，而非安抚香港人的感受	71
2020-01-10	中联办主任换将背后，到底有何种考量？	https://nei.st/medium/initium/opinion-hk-luohuining	骆惠宁的首要使命，是整治北京在香港的治港系统，不折不扣地贯彻和落实习近平的治港决策和部署，建立一个信息上情下达的畅通机制，向北京反映香港的真实情状	72
2020-01-10	基因编辑边界何在	https://nei.st/medium/caixin/cw887c	两例基因编辑人类胚胎用于妊娠案例的出现，意味着「潘多拉魔盒」已经打开。这把「魔剪」的应用边界到底在哪里？	72
2020-01-10	双车追逐	https://nei.st/medium/economist/two-is-traffic	奔驰汽车的制造商可能很快将有五分之一股权落入中资手中	72
2020-01-10	「香港不太好」：抗议颠覆了这里的生活	https://nei.st/medium/wsj/hong-kongs-not-right-protests-upend-life-in-a-city-on-edge	持续数月的抗议让香港的未来变得难以预测，居民们不得不面对一些让人难过又艰难的选择	72
2020-01-10	中国股市经历「失落的十年」，但投资者看好未来表现	https://nei.st/medium/wsj/it-was-a-lost-decade-for-chinas-stock-market-but-investors-bet-on-better-times-ahead	根据以本币计算的价格表现，过去十年其他国家股指只有少数出现下跌。中国股市的糟糕表现与强劲的经济增长形成鲜明对比	72
2020-01-10	猪肉、汽车、口红与商品房，中国人在消费什么？	https://nei.st/medium/initium/mainland-economic-data-consumption	三四线城市年轻人陷入「低收入、高消费欲」，一二线城市中产则被房价压得喘不过气	72
2020-01-10	垃圾分类再考验	https://nei.st/medium/caixin/cw887b	北京即将进入生活垃圾全面强制分类时代。这个环环相扣、牵一发而动全身的系统工程，哪一环掉了链子便不可持续	72
2020-01-10	北京垃圾分类简史	https://nei.st/medium/caixin/cw887a	作为一场社会实验，北京的垃圾对策先后经过了自然循环、堆放污染、标准化填埋、焚烧+和减量化资源化五个阶段	72
2020-01-10	一图胜千言	https://nei.st/medium/economist/a-thousand-words	为何支持移民——你可能未曾见过的论证	72
2020-01-10	孙小波三年发审委员 受贿 700 万「雪花银」	https://nei.st/medium/caixin/sj100ntt_2n5z1iwen6xxa	每一家企业上市，都要提着一箱子现金去送钱。这是发审制度下的潜规则	72
2020-01-10	中国重回以铁路投资刺激经济的老路	https://nei.st/medium/wsj/china-rides-the-railroads-to-boost-its-slowing-economy	在某种意义上，这种投资力度的加大与中国国家主席习近平控制中国债务规模的努力背道而驰。中国拥有世界上最大的铁路网，但几乎没什么赚钱的线路	73
2020-01-10	先别盲目乐观，中国的放缓还未结束	https://nei.st/medium/wsj/check-your-optimism-chinas-slowdown-isnt-over	今年的季节性流动性紧张情况将比往年更为严重	73
2020-01-10	中国叫停沪伦通	https://nei.st/medium/wsj/china-pauses-u-k-listings-project	此举可能表明中英金融关系降温	73
2020-01-10	科技与社会：悲观对阵进步	https://nei.st/medium/economist/pessimism-v-progress	当下人们对科技之影响的担忧在历史上有迹可循	73
2020-01-10	加州的数据警长	https://nei.st/medium/economist/californias-data-sheriffs	将感受到「金州」新隐私法影响的远不止州内企业	73
2020-01-10	为何全球 1\4 生猪会在一年之内死亡	https://nei.st/medium/nytimes/why-did-one-quarter-of-the-worlds-pigs-die-in-a-year	非洲猪瘟暴露了中国在动物疾病防控上的弱点，更揭示出中国政府治理体系的不健全，在这个体系之下，即使健全的监管也会产生坏的影响	73
2020-01-10	孙正义的 2020 年购物清单	https://nei.st/medium/bloomberg/heres-a-masayoshi-son-shopping-list-for-2020	数字指针如此糟糕，让人看了不禁苦笑	73
2020-01-10	AI 能做到	https://nei.st/medium/economist/the-world-in-2020/ai-can-do-that	人工智能对未来一年有何看法？我们决定问一问由旧金山 OpenAI 研发的 GPT-2 大规模无监督语言模型	73
2020-01-10	让你的孙辈震惊的事	https://nei.st/medium/economist/the-world-in-2020/what-will-horrify-your-grandchildren	如今人们习以为常的观点和行为中，有哪些会遭到子孙后代的谴责？	73
2020-01-10	「单病例」药物亮相	https://nei.st/medium/economist/the-world-in-2020/introducing-n-of-1-drugs	2020 年，一位父亲将创造一种新药来尝试挽救女儿的生命	73
2020-01-10	富士康连环跳幸存者田玉：十年来，亲手重建生活	https://nei.st/medium/southern/nfzm-1871c	已经没有人——包括田玉自己——能说清压垮她的最后一根稻草是什么。她不愿回忆过往，但她清晰地知道，当初作出的那个决定，她后悔了	74
2020-01-10	郭美美：「对不起！这句话欠大家很多年了」	https://nei.st/medium/southern/nfzm-1871b	2019 年 7 月 13 日深夜，郭美美走出监狱，重获自由	74
2020-01-10	吴英父亲：拎着 120 斤的箱子，奔走 14 年	https://nei.st/medium/southern/nfzm-1871d	吴英案，是受到广泛关注的民间金融案例，至今仍出现在大学法学院的课堂上	74
2020-01-10	高铁奇迹：「我们一直没停」	https://nei.st/medium/southern/nfzm-1871a	自 2008 年至今，中国高铁运营里程已接近 3.5 万公里，超过全球高铁总里程的 2/3。中国成为世界上高铁运营里程最长、计划建设规模最大、运输密度最高、成网运营场景最复杂的国家	74
2020-01-10	科学增压器	https://nei.st/medium/economist/the-world-in-2020/a-supercharger-for-science	DeepMind 的联合创始人兼首席执行官德米斯·哈萨比斯表示，人工智能可以促进诸多领域的研究	74
2020-01-10	房价图解	https://nei.st/medium/economist/the-world-in-2020/house-prices-in-graphic-detail	2020 年泡沫破灭的机会有多大？	74
2020-01-10	建造元界	https://nei.st/medium/economist/the-world-in-2020/building-a-metaverse	科幻中的一类虚构正在 (非常缓慢地) 变为现实	74
2020-01-10	「悠得人」的十年	https://nei.st/medium/economist/the-world-in-2020/the-decade-of-the-yold	约翰·帕克 (John Parker) 预测，即将迈入 65 岁的人们不会悄悄隐退	74
2020-01-10	我们处在爆炸式创新的前夜	https://nei.st/medium/economist/the-world-in-2020/the-coming-innovation-explosion	华为创始人兼 CEO 任正非认为，开放合作是打开未来大门的钥匙	74
2020-01-10	窥见前方世界	https://nei.st/medium/economist/the-world-in-2020/glimpses-of-the-world-ahead	科幻作品大多不具有预测性，但仍可以作为未来的一种指引，汤姆·斯坦迪奇 (Tom Standage) 指出	74
2019-12-31	揭秘中国黑客「云端跳跃」攻击内幕	https://nei.st/medium/wsj/ghosts-in-the-clouds-inside-chinas-major-corporate-hack	过去几年，被指为中国情报机构工作的网络攻击者通过云服务供应商从数十家公司窃取了大量知识产权、安全许可信息和其他记录，这是有史以来规模最大的商业间谍活动之一	1
2019-12-31	负利率政策的经济学逻辑	https://nei.st/medium/caixin/cnreform408-lezvao29vrotlbt46xdloq	在温和通胀的前提下，潜在产出是决定执行负利率的根本锚。也就是说，在中美经济增速回落到充分低之前，并不适合执行长期负利率政策	1
2019-12-31	全国 2019 年卖地收入刷新历史纪录	https://nei.st/medium/caixin/iuagum94khge	50 大城市卖地收入超过 4 万亿，这是历史上第一次	1
2019-12-31	天主与财神	https://nei.st/medium/economist/god-and-mammon	中世纪的天主教帮助推动了欧洲走向民主与发展​	1
2019-12-31	新疆死结	https://nei.st/medium/initium/opinion-xj-policy	杨凤岗：新疆问题的症结是什么？能走出困境吗？	1
2019-12-31	中国麻烦不断之际，习近平获封「人民领袖」称号	https://nei.st/medium/wsj/as-chinas-troubles-mushroom-xi-collects-a-special-title	这一荣誉称号直接仿效着中华人民共和国创始人毛泽东的称号	1
2019-12-31	中国地方政府大量债务即将到期	https://nei.st/medium/wsj/bills-come-due-for-chinas-local-governments	中国地方政府已积累超过 6 万亿美元债务	1
2019-12-31	中国滞胀？	https://nei.st/medium/wsj/china-is-taking-no-chances-with-stagflation	中国消费物价正在以近十年来最快的速度上升，经济增长则处于三十年来最缓慢的水平	1
2019-12-31	2020 年中国主要风险将由贸易变为债务	https://nei.st/medium/wsj/china-2020-trade-risks-become-debt-risks	房地产和国有行业以及基础设施是中国经济体系中债务负担最沉重的领域	1
2019-12-31	2020 年的旅行有什么变化？	https://nei.st/medium/bloomberg/how-travel-will-change-in-2020	八种趋势将重塑人们的出行方式	1
2019-12-31	领航的中国野心：机器人顾问、5,700 只基金和 9 亿人	https://nei.st/medium/wsj/vanguards-china-gambit-one-robo-adviser-5700-funds-and-ants-900-million-users	领航曲线开拓中国公募基金市场	2
2019-12-31	制造了他者，消失了国民──中国少数民族问题的根源	https://nei.st/medium/initium/opinion-zou-minority	传统中华天下，海内国民，并无特殊的民族意识。而一旦中华天下被外来民族所统治，则往往建立民族等级制度，辽、元如此，满清也是如此	2
2019-12-31	2020 年，中国还会出现「灰犀牛」事件吗	https://nei.st/medium/nytimes/dengyuwen-2020-prediction	比起动荡不安的 2019 年，反有可能显得相对平静	2
2019-12-31	权力剧场中，威权是如何被「加冕」的？	https://nei.st/medium/initium/mainland-wu-guoguang-interview	既不是 1930 年代的德国，也不是 1980 年代的苏联，中国给全球化时代的民主国家带来了新问题，而问题的根源，在于中共不同于民主制度、也不同于一般威权制度的独特统治术：创立正式制度，然后操控它，透过改变游戏规则，来改变游戏结果	2
2019-12-31	抖音快手对决商业化	https://nei.st/medium/caixin/cw886f	短视频成为移动互联网时代最后一波大风口，抖音快手战况胶着，中国互联网版图正在重划	2
2019-12-31	地陷惊心	https://nei.st/medium/caixin/cw886g	地下工程施工导致的突变型地陷增多，常致伤亡；各地地铁建设应建章立制，制衡「赶工期」冲动	2
2019-12-31	武清湿地别墅整治难题	https://nei.st/medium/caixin/cw886c	省级自然保护区里的别墅群被中央环保督察要求整改，压力层层传导之下政府征迁加速，补偿尚未谈妥，开发商五证齐全的地块被收回，业主有产权证的房屋被拆除。生态保护的「千年大计」遭遇政府违规审批的历史因素，该如何纠偏？	2
2019-12-31	*ST 盐湖：「美梦」变噩梦	https://nei.st/medium/caixin/cw886e	循环经济的外衣很美，但如果生产项目的设备工艺不过关、生产成本高昂、产品附加值低，市场需求不足，再美的外衣都遮不住必然亏损的现实	2
2019-12-31	*ST 盐湖重整 在争议中推进	https://nei.st/medium/caixin/cw886d	盐湖重整案有其特殊性，保住了地方政府在这家国企的控股权；但从破产重整的法治原则而言，此案不足法	2
2019-12-31	债券违约之后	https://nei.st/medium/caixin/cw886b	募集说明书有缺陷，持有人大会没用，受托管理人缺位，资产保全难，追责无门，难以约束地方政府——债券违约已成常态，处置却仍然缺少法治保障	2
2019-12-31	债市监管漏洞	https://nei.st/medium/caixin/cw886a	债市规模已经足够大，机会足够多，规则也足够支离破碎和漏洞百出	3
2019-12-31	看过来！	https://nei.st/medium/economist/word-up	《经济学人》年度书单	3
2019-12-31	为何「发展」与「开明」没能解决新疆问题？	https://nei.st/medium/initium/opinion-xinjiang-7-5	新疆问题似乎陷入某种循环：民族交往和提振经济是长久之策，却会带来摩擦和冲突；强力维稳则容易形成「种族隔离」的局面，让民族意识更加强化	3
2019-12-31	重磅调查：中缅穿山甲走私	https://nei.st/medium/initium/pangolin-trade-in-myanmar	为了满足中国市场，缅甸的穿山甲交易无处不在，毫无节制，易买易卖，「就像淘宝购物一样」	3
2019-12-31	恒丰银行千亿重组	https://nei.st/medium/caixin/cw885f	中央汇金认购 600 亿股，山东省政府仍是恒丰银行的实际控制人；清理问题股权、重塑组织架构和重建风险防线等，「刮骨疗毒」正在进行	3
2019-12-31	走上国际法庭的昂山素季，与她如履薄冰的政经愁局	https://nei.st/medium/initium/opinion-aungsansuukyi-politicaleconomy	经济不及预期，和平进程遥遥无期，军方权力仍然难以撼动——从民主典范「黑化」和「堕落」的昂山素季，似乎也没有别的选择	3
2019-12-31	新疆模式：「制度自信」的苦涩注脚，与欧亚大陆的灰暗现实	https://nei.st/medium/initium/opinion-xinjiang-world	新疆的「再教育」说明了中国道路的内在尴尬，但也折射着欧亚世界的复杂	3
2019-12-31	《维吾尔人》——「民族团结」之下的愤懑与反抗	https://nei.st/medium/initium/book-xinjiang	一种关于「中华民族」成员的深刻分歧，潜藏在新疆社会生活的表面之下	3
2019-12-31	新疆的「再教育」：从「多元帝国」到「民族同化」	https://nei.st/medium/initium/opinion-xinjiang-re-education	再教育营的存在是一个悲剧，意味着中国政府已经摒弃了中国传统，并开始采纳西方的民族主义意识形态来治理其多民族社会	3
2019-12-31	征服者进退维谷	https://nei.st/medium/economist/conquistadors-in-a-quandary	西班牙公司苦战拉美	3
2019-12-31	2019 中国电影大盘点：意识形态全面接管，官方与观众有共谋？	https://nei.st/medium/initium/movies-mainland-2019	国庆大片是官方精心策划，观众却报以充沛热情。当行业环境更严苛，所有人都要适应新规则，2019 年会是这漫长过程的开始吗？	4
2019-12-31	广深高速磁悬浮铁路争议	https://nei.st/medium/caixin/cw884h	高速磁悬浮技术的确可为两地通行节省一半时间。但这一技术是否安全可靠，投资回报是否经济，引发轮轨派和磁浮派又一次交手	4
2019-12-31	2019 网络热搜观察指南	https://nei.st/medium/yimag/rtv0zfleltva1xjbgn4f9a	我们生活在网上，而网络世界围着热搜转。在辞旧迎新之际，让我们围着烛光静静回顾下今年有哪些热搜戳中了我们的 G 点，有哪些热搜创造了新的网络文化，又有哪些热搜深刻影响了我们的生活抑或承载了我们对生活的强烈吐槽。如果你最近在网上冲浪时越来越看不懂「年轻人的话题」，这也是一次集中补习的好机会	4
2019-12-31	京沪高铁的神话与现实	https://nei.st/medium/yimag/qfffuogdtgnh	挣钱最多的中国高铁线路背后，是由制度和市场精心组织起来的资产，以至于它的上市经历也显得意味深长——不为赚钱为改革	4
2019-12-31	今年看直播了吗？卖货那种	https://nei.st/medium/yimag/muxkx08hqigvyna3pka	电商、直播、带货、网红……这 4 个概念全都不新鲜，然而将它们组合起来之后，年轻人的购物方式就又一次被改变了	4
2019-12-31	快手和抖音，安内与攘外	https://nei.st/medium/yimag/ysfkokzqs5g5hmkj7hbrgg	或加速掘金，或另辟市场—2019 年，两个国内用户规模最大的短视频应用战事胶着	4
2019-12-31	论澳门「一国两制」模式的可持续性	https://nei.st/medium/21c/the-sustainability-of-macaos-one-country-two-systems-model	澳门回归后维持政治稳定的重要原因：亲北京力量主导的政治体制，澳门政府的「分赃」政策，政府主要官员的内地背景	4
2019-12-31	华为 2019	https://nei.st/medium/yimag/nvjyxczldazqsn7o3c1tia	所有可能发生的冲突都发生了	4
2019-12-31	政府支持铺就华为全球崛起之路	https://nei.st/medium/wsj/state-support-helped-fuel-huaweis-global-rise	华为对于中国政府给予该公司的激励措施披露有限。但《华尔街日报》的评估显示，包括税项减免、政府信贷安排、土地购买和政府拨款在内，华为获得的政府财政援助最高可能达到 750 亿美元	4
2019-12-31	食品黑科技崛起	https://nei.st/medium/caixin/cw885e	人造肉，实验室养虾，仓库里种菜——为了口吃的，新加坡什么都在试	4
2019-12-31	万亿级芯片	https://nei.st/medium/economist/a-trillion-here-a-trillion-there	如何用超大芯片打造小型超级计算机	5
2019-12-31	谁来接替新能源汽车补贴？	https://nei.st/medium/caixin/cw885d	积分交易接续补贴是政策初衷。当前积分价格远低于预期，新能源汽车难以维持增长	5
2019-12-31	芬兰给世界的启示：年轻女性领导新政府意味着什么？	https://nei.st/medium/initium/finland-female-leaders	「如果没有人跟随你脚步的话，打破玻璃天花板是没有意义的。」	5
2019-12-31	为何奢侈品牌在富人比例较高的美国不吃香？	https://nei.st/medium/wsj/america-is-a-land-of-unequal-opportunity-for-luxury-brands	美国可投资资产规模不低于 100 万美元的高净值个人数量多达 530 万，但让他们购买高端手袋和服装却并非易事	5
2019-12-31	「吸血鬼」沿网线而来	https://nei.st/medium/caixin/cw884d	浙江温岭警方破获迄今最大规模的「套路贷」单体公司，短短一年中向 9 万人累计放贷 2.9 亿元，至少 6 人在越滚越大的债务和「软暴力」催收下自杀身亡	5
2019-12-31	巴菲特 2020 年的决心是？	https://nei.st/medium/bloomberg/warren-buffetts-2020-new-years-resolution	找到最后一头大象	5
2019-12-31	中美贸易变化	https://nei.st/medium/economist/how-us-china-trade-has-changed	一年纷扰见图示	5
2019-12-20	国家管网公司破土	https://nei.st/medium/caixin/cw885c	先挂牌后组建，国家管网公司的成立，势将重构中国石油天然气的行业格局。资产重组、公司治理和监管体系的搭建，仍有很多工作要做	5
2019-12-20	中国拒绝洋垃圾引发全球废物处理方式巨变	https://nei.st/medium/wsj/recycling-rethink-what-to-do-with-trash-now-that-china-wont-take-it	中国已下令禁止进口混合废纸和塑料，并严格限制其他废料。西方垃圾的其他热门市场也各自实施了类似措施。这些举措导致全球处理废物方式发生了巨大变化	5
2019-12-20	高端医疗设备配额战	https://nei.st/medium/caixin/cw884e	价格超过 3000 万元，单次费用超过 1 万元，且使用率高的甲类医疗设备，受到严格的配额管理，民营医疗一票难求	5
2019-12-20	作为「世界的圣诞工厂」，中国圣诞产品都销往哪里？	https://nei.st/medium/initium/mainland-christmas-products-output	义乌圣诞村有 600 家工厂，它们生产了全世界三分之二的圣诞消费品	6
2019-12-20	对赌失败后的出表套路	https://nei.st/medium/caixin/cw884i	并购标的业绩对赌失败后，上市公司开始琢磨资产出售和出表的招数，看上去「皆大欢喜」的局面却在挑战监管边界	6
2019-12-20	中国受形势所迫弱化减煤行动	https://nei.st/medium/wsj/in-tougher-times-china-falls-back-on-coal	尽管已承诺采取措施减少煤炭的使用，但中国的煤炭用量出现反弹，并已回升至接近峰值的水平	6
2019-12-20	昂贵的清洁取暖	https://nei.st/medium/caixin/cw884f	燃煤中毒事故只是一个表象，用户、企业和政府三方的账本都显示，华北地区全力推进的清洁取暖昂贵得出人意料	6
2019-12-20	高糖之殇	https://nei.st/medium/economist/sugar-high	随着中国人体重增加，2 型糖尿病患者正在激增	6
2019-12-20	柳传志谢幕	https://nei.st/medium/caixin/cw885b	75 岁的柳传志退休，联想准备好了吗？	6
2019-12-20	游戏巨头再战海外	https://nei.st/medium/caixin/cw884g	中国游戏版号收紧，腾讯和网易转战欧美日成熟市场，胜算几何？	6
2019-12-20	中国的新民间宗教	https://nei.st/medium/nytimes/chinas-new-civil-religion	在打压伊斯兰教和基督教同时，中共选择接纳复兴传统信仰，一种新的民间宗教正在形成。这不仅是为了解决道德真空，更是为了政治利益	6
2019-12-20	征收关税之后	https://nei.st/medium/economist/life-after-tariffs	当美国竖起围墙时，中国的出口商发现了新大陆	6
